{
  "$schema": "https://json-schema.org/draft/2020-12/schema",
  "$id": "https://cdd.local/schemas/run_manifest.schema.json",
  "title": "RunManifest",
  "type": "object",
  "additionalProperties": false,
  "required": [
    "run_id", "company_id", "company_name", "started_at", "completed_at",
    "mode", "input_parameters", "reproducibility", "sources_discovered",
    "sources_retrieved", "sources_new", "sources_changed", "sources_unavailable",
    "artifacts_extracted", "schemas_validated", "output_paths", "warnings", "errors"
  ],
  "properties": {
    "run_id": {"type": "string", "pattern": "^[0-9]{8}T[0-9]{6}Z-[0-9a-z]{4,12}$"},
    "company_id": {"type": "string", "minLength": 1},
    "company_name": {"type": "string", "minLength": 1},
    "started_at": {"type": "string", "format": "date-time", "pattern": "^[0-9]{4}-[0-9]{2}-[0-9]{2}T[0-9]{2}:[0-9]{2}:[0-9]{2}Z$"},
    "completed_at": {"type": ["string", "null"], "format": "date-time", "pattern": "^[0-9]{4}-[0-9]{2}-[0-9]{2}T[0-9]{2}:[0-9]{2}:[0-9]{2}Z$"},
    "mode": {
      "type": "string",
      "enum": [
        "full_refresh", "incremental_refresh", "source_discovery_only",
        "source_retrieval_only", "extraction_only", "validation_only",
        "dossier_only", "compare_runs"
      ]
    },
    "input_parameters": {"type": "object"},
    "reproducibility": {
      "type": "object",
      "additionalProperties": false,
      "required": ["prompt_set_hash", "schema_set_hash", "model_id",
                   "tool_versions", "normalizer_profile_versions", "locale"],
      "properties": {
        "prompt_set_hash": {"type": ["string", "null"]},
        "schema_set_hash": {"type": ["string", "null"]},
        "model_id": {"type": ["string", "null"]},
        "tool_versions": {"type": "object"},
        "normalizer_profile_versions": {"type": "object"},
        "locale": {"type": ["string", "null"]}
      }
    },
    "sources_discovered": {"type": "integer", "minimum": 0},
    "sources_retrieved": {"type": "integer", "minimum": 0},
    "sources_new": {"type": "integer", "minimum": 0},
    "sources_changed": {"type": "integer", "minimum": 0},
    "sources_unavailable": {"type": "integer", "minimum": 0},
    "artifacts_extracted": {"type": "integer", "minimum": 0},
    "schemas_validated": {"type": "boolean"},
    "output_paths": {"type": "array", "items": {"type": "string"}},
    "warnings": {"type": "array", "items": {"type": "string"}},
    "errors": {"type": "array", "items": {"type": "string"}}
  }
}
