{
  "run_id": "20260620T183000Z-a1b2c3",
  "company_id": "acme-analytics",
  "company_name": "Acme Analytics, Inc.",
  "started_at": "2026-06-20T18:30:00Z",
  "completed_at": "2026-06-20T19:14:27Z",
  "mode": "full_refresh",
  "input_parameters": {
    "company_name": "Acme Analytics, Inc.",
    "legal_name": "Acme Analytics, Inc.",
    "website": "https://www.acmeanalytics.com",
    "ticker": "ACME",
    "exchange": "NASDAQ",
    "country": "US",
    "industry": "Business Intelligence & Analytics Software",
    "subsidiaries": ["Acme Data Labs", "Acme Cloud Services"],
    "brands": ["AcmeBI", "AcmePulse"],
    "research_focus": [
      "financial_performance",
      "product_portfolio",
      "management_team",
      "competitive_landscape",
      "recent_events",
      "customer_base"
    ]
  },
  "reproducibility": {
    "prompt_set_hash": "sha256:4a7f3c9e2b1d8e6f0a5c9b3d7e1f4a8c2b6d0e9f3c7a1b5d9e3f7c2a6b0d4e8",
    "schema_set_hash": "sha256:9b3e7a1f5c2d6b0e4a8c3f7d1e5b9a2c6f0d4e8b3a7c1e5f9d2b6a0c4f8e1d5",
    "model_id": "claude-opus-4",
    "tool_versions": {
      "cdd": "0.1.0",
      "jsonschema": "4.23.0"
    },
    "normalizer_profile_versions": {
      "html": "1"
    },
    "locale": "en-US"
  },
  "sources_discovered": 14,
  "sources_retrieved": 12,
  "sources_new": 12,
  "sources_changed": 0,
  "sources_unavailable": 1,
  "artifacts_extracted": 23,
  "schemas_validated": true,
  "output_paths": [
    "output/companies/acme-analytics/runs/20260620T183000Z-a1b2c3/structured/company_profile.json",
    "output/companies/acme-analytics/runs/20260620T183000Z-a1b2c3/structured/financials.json",
    "output/companies/acme-analytics/runs/20260620T183000Z-a1b2c3/structured/management_team.json",
    "output/companies/acme-analytics/runs/20260620T183000Z-a1b2c3/structured/competitors.json",
    "output/companies/acme-analytics/runs/20260620T183000Z-a1b2c3/reports/final_dossier.md",
    "output/companies/acme-analytics/runs/20260620T183000Z-a1b2c3/reports/data_quality_report.md"
  ],
  "warnings": [
    "SEC EDGAR filing for Q1 2026 10-Q not yet available; used investor press release instead"
  ],
  "errors": []
}
